id,subfunction_description_id,deliverable,frequency_deliverable,responsible,accountable,support,consulted,informed
142,153,Legal Functional Audit,As Needed,"Legal Counsel, Senior Legal Counsel",Chief Legal Officer,"Associate Legal Counsel, Paralegal",Chief Executive Officer,Concerned Employees
143,154,Organizational & Functional Structures,As needed,Assistant Organizational Development Manager,Chief Human Resources Officer,"Talent Management & Total Rewards Officer, Talent Acquisition & HR Operations Head",Concerned Teams,All Employees
144,155,"Job, Competency profiles",As Needed,Assistant Organizational Development Manager,Chief Human Resources Officer,"Talent Management & Total Rewards Officer, Talent Acquisition & HR Operations Head",Concerned Teams,All Employees
145,197,Workforce Planning,As Needed,Talent Management & Total Rewards Officer,Chief Human Resources Officer,"Assistant Organizational Development Manager, Corp Business Development Team",Executive Committee,Concerned Employees
146,227,"PMS toolkit for Corporate, subsidiaries; Corporate PMS & Executive PMS",Annually,Assistant Organizational Development Manager,Chief Human Resources Officer,"Corporate Chiefs, Business Unit Heads",Chief Executive Officer,All Employees
147,228,"Salary survey reports, Benchmark reports, Job Evaluation and Leveling, Salary Structure",Annually,Talent Management & Total Rewards Officer,Chief Human Resources Officer,"Assistant Organizational Development Manager, Human Resources Head (Business Units)","Corporate Chiefs, Business Unit Heads",Concerned Employees
148,229,"Rewards and Retention program, Compensation and benefits package",Annually,Talent Management & Total Rewards Officer,Chief Human Resources Officer,"Assistant Organizational Development Manager, Human Resources Head (Business Units)","Corporate Chiefs, Business Unit Heads",Concerned Employees
149,156,"Succession, Transition Plans",Annually,Talent Management & Total Rewards Officer,Chief Human Resources Officer,"Assistant Organizational Development Manager, Human Resources Head (Business Units)","Corporate Chiefs, Business Unit Heads",All Employees
150,157,"Executive Sourcing, Selection & Corporate Sourcing, Selection",As Needed,Talent Acquisition & HR Operations Head,Chief Human Resources Officer,"HR Officer, Talent Management & Total Rewards Officer","Corporate Chiefs, Business Unit Heads",All Employees
151,158,Employer Branding,As Needed,HR Officer,Talent Acquisition & HR Operations Head,Communications & Branding Manager; HR Talent Acquisition (Business Units),"Executive Committee, Business Unit Management Committee",All Employees
152,159,Talent Classification,Annually,Talent Management & Total Rewards Officer,Chief Human Resources Officer,"Assistant Organizational Development Manager, Human Resources Head (Business Units)","Corporate Chiefs, Business Unit Heads","Corporate Chiefs, Business Unit Heads"
153,160,Executive Leadership Development,Annually,Chief Human Resources Officer,Chief Executive Officer,"Learning & Engagement Officer / Head, Talent Management & Total Rewards Officer",Succession Committee (Executive),None
154,198,Career Development for Non-executives,Annually,Talent Management & Total Rewards Officer,Chief Human Resources Officer,"Learning & Engagement Officer, HR Learning & Development (Business Units), Human Resources Head (Business Units)","Corporate Chiefs, Business Unit Heads",None
155,199,"Training Needs Analysis, Individual Development",Annually,Learning & Engagement Officer,Chief Human Resources Officer,All People Managers,All Employees,All Employees
156,200,"Learning Curriculum, Learning Calendar",Annually,Learning & Engagement Officer,Chief Human Resources Officer,HR Learning & Development (Business Units),Learning Service Providers,All Employees
159,164,Corporate and Executive PMS,Annually,Assistant Organizational Development Manager,Chief Human Resources Officer,"Corporate Chiefs, Business Unit Heads",Chief Executive Officer,All Employees
160,165,HRIS Administration,Annually,HCM Analyst,Chief Human Resources Officer,Talent Acquisition & HR Operations Head,"Executive Committee, Business Unit Management Committee",All Employees
161,166,Files and data,As Needed,HR Officer,Talent Acquisition & HR Operations Head,HCM Analyst,None,Concerned Employees
162,230,"Payroll Register, Government Remittances, Benefits Support",Monthly,HR Officer,Talent Acquisition & HR Operations Head,"Payroll Specialist, Benefits Specialist",None,All Employees
163,231,"HR Policy, HR Operating Manual",As Needed,Talent Acquisition & HR Operations Head,Chief Human Resources Officer,Corp Human Resources Team,Corp Legal Team,All Employees
164,232,Compliance report,As Needed,HR Officer,Talent Acquisition & HR Operations Head,HR Operations (Business Units),"Corp Legal Team, HR Operations (Business Units)",Concerned Government Agencies
168,170,External Trainings,As Needed,Learning & Engagement Officer,Chief Human Resources Officer,All People Managers,Learning Service Providers,All Employees
169,171,"Employee Engagement Survey (Engagement Index, Retention Score, NPS)",Annually,Assistant Organizational Development Manager,Chief Human Resources Officer,Human Resources Head (Business Units),"Executive Committee, Business Unit Management Committee",All Employees
170,172,SIGLA Culture Renewal,As Needed,Assistant Organizational Development Manager,Chief Human Resources Officer,HR Organizational Development (Business Units),"Executive Committee, Business Unit Management Committee",All Employees
171,173,Learning Culture,As Needed,Learning & Engagement Officer,Chief Human Resources Officer,HR Learning & Development (Business Units),"Executive Committee, Business Unit Management Committee",All Employees
176,178,HRIS Dashboard,As Needed,HR Officer,Talent Acquisition & HR Operations Head,HCM Analyst,"Executive Committee, Business Unit Management Committee","Executive Committee, Business Unit Management Committee"
177,179,"Meeting Agenda, Report",Monthly,Corp Human Resources Team,Chief Human Resources Officer,None,None,Human Resources Teams (Business Units)
178,180,HR Functional Audit,Monthly,Corp Human Resources Team,Chief Human Resources Officer,None,None,Human Resources Teams (Business Units)
179,181,HR Governance,As Needed,Corp Human Resources Team,Chief Human Resources Officer,None,None,Human Resources Teams (Business Units)
180,182,Advisory,As Needed,Talent Acquisition & HR Operations Head,Chief Human Resources Officer,None,Corp Legal Team,Human Resources Teams (Business Units)
181,183,"Daily Messengerial & Driver Services, Travel & Accommodation Services, Telecommunication Services, Vehicle Management (insurance, registration, repairs maintenance)",As Needed,Admin & Purchasing Assistant,Admin & Purchasing Manager,"Executive Assistants, Drivers, Messengers",Corporate Comptroller,Concerned Employees
182,184,"Purchase / Job Order, Delivered goods, Office supplies inventory",As Needed,Admin & Purchasing Assistant,Admin & Purchasing Manager,Concerned Employees,Corporate Comptroller,Concerned Employees
183,185,Audit program and report,Annually,Internal Audit Officer,Head of Internal Audit,None,None,"Concerned Teams, Audit Committee"
184,186,Internal Audit Report,Annually,Internal Audit Officer,Head of Internal Audit,None,None,"Concerned Teams, Audit Committee"
185,187,Audit program and report,Annually,Internal Audit Officer,Head of Internal Audit,None,None,"Concerned Teams, Audit Committee"
186,188,Audit program and report,Annually,Internal Audit Officer,Head of Internal Audit,None,None,"Concerned Teams, Audit Committee"
187,189,Audit program and report,Annually,Internal Audit Officer,Head of Internal Audit,None,None,"Concerned Teams, Audit Committee"
188,190,Audit program and report,Annually,Internal Audit Officer,Head of Internal Audit,None,None,"Concerned Teams, Audit Committee"
189,191,Audit program and report,Annually,Internal Audit Officer,Head of Internal Audit,None,None,"Concerned Teams, Audit Committee"
190,202,Investigation and recommendation reports,Annually,Internal Audit Officer,Head of Internal Audit,None,"Chief Human Resources Officer, Chief Legal Officer","Concerned Teams, Audit Committee"
191,225,"Branding Guidelines, Brand Book (visual guidelines)",Annually,Chief CCAB Officer,Chief Executive Officer,Communications & Branding Manager,Communications & Branding Managers (Business Units),All Employees
192,203,"Branding Guidelines, Brand Book (visual guidelines), Branding, Marketing committee meetings",As Needed,Communications & Branding Manager,Chief CCAB Officer,Communications & Branding Managers (Business Units),"Executive Committee, Business Unit Management Committee","All Employees, Communications & Branding Managers (Business Units)"
193,206,"Corporate videos, infographics; Digital, printed branding materials",As Needed,Communications & Branding Manager,Chief CCAB Officer,"Communications & Branding Managers (Business Units), Third-Party Service Providers",None,"Executive Committee, Business Unit Management Committee"
194,207,1,1,1,1,1,1,1
195,204,"Concept Boards, Project Briefs",Annually,Communications & Branding Manager,Chief CCAB Officer,Third-Party Service Providers,Chief Executive Officer,"Executive Committee, Business Unit Management Committee"
198,218,Compliant Bid Submission,As Needed,Business Development Director,Chief Business Development Officer,"Business Development Manager, Business Development Officer","Chief Executive Officer, Business Unit Heads, Concerned Teams","External Stakeholders, Stakeholder Relations Officer"
199,219,"Business Plans, Permits and licenses, Compliant documents, Design Review, Committee & Organizational Structure, Established Processes & Procedures",As Needed,Business Development Manager / Business Development Officer,Business Development Director,Business Development Officer / Business Development Manager,"Chief Business Development Officer, Concerned Teams","Chief Executive Officer, Management Investment Committee"
200,220,"Value-adding insights, Strategic directions",As Needed,Business Development Director,Chief Business Development Officer,"Business Development Manager, Business Development Officer","Chief Executive Officer, Business Unit Heads, Concerned Teams","Executive Committee, Business Unit Management Committee"
201,226,"Crisis communication plan, Drafted holding statements, Q&A documents",As Needed,Communications & Branding Manager,Chief CCAB Officer,"Corp Legal Team, Stakeholder Relations Officer","Chief Executive Officer, Business Unit Heads",Target Audience